site_id,name,address,point_x,point_y,site_use,status_id,drain_acres,imp_percent,imp_acres,an_runoff,retro_type_id,bmp_type_ids,feasibility_id,dsgn_dfclt_id,wtrshd_bft_id,priority_id,source_ids
232,barclay em school,2900 barclay st es/msps54,-76.61194353,39.32394433,unused impervious area replaced with vegetation,1,,,,,,8,,,,,7
233,curtis bay em school,4301 10th st,-76.59827042,39.22613004,unused impervious area replaced with vegetation,1,,,,,,8,,,,,7
234,mad cho stream restoration p1 (mc10),beechfield ave,-76.68589393,39.27814093,"stream restoration, utility protection, improve bio-habitat",1,,,,,,"15, 18, 7",,,,,7
235,watershed 263 phase i,nwcnr wfairmount &fulton ave c13,-76.64541398,39.28897877,unused impervious area replaced with vegetation,1,,,,,,8,,,,,7
236,watershed 263 phase i,alley bet nfulton nbruce st i1,-76.64474264,39.29146525,unused impervious area replaced with vegetation,1,,,,,,8,,,,,7
237,watershed 263 phase i,nwcnr w.fayettest n.mount st b13,-76.64393571,39.28972967,unused impervious area replaced with vegetation,1,,,,,,8,,,,,7
238,watershed 263 phase i,nwcnr nfulton wlexington st b15,-76.64541483,39.29084132,unused impervious area replaced with vegetation,1,,,,,,8,,,,,7
239,charles street culvert repair,n charles st over remove,-76.62247815,39.34748981,culvert repair,1,,,,,,2,,,,,7
240,yorkwood elementary school greening phase iii,yorkwood elementary school,-76.58131652,39.36322209,xx ac unused impervious area replaced with vegetation,1,,,,,,8,,,,,7
241,francis scott key em school greening phase - mpa,"francis scott key es/ms, ps #76",0,0,greening project only no asphalt removed - phill lee mpa,1,,,,,,8,,,,,7
242,windsor hills em school greening phase - mpa,"windsor hills es/ms, ps#87",0,0,xx ac unused impervious area replaced with vegetation,1,,,,,,8,,,,,7
